Sheet: Sheet1
C2: 1 | D2: 2 | E2: 3 | F2: 4 | G2: 5 | H2: 6 | I2: 7 | J2: 8 | K2: 9 | L2: 10
B3: 1 | C3: =R2C3*RC[-1] -> 1 | D3: =R2C*RC2 -> 2 | E3: =R2C*RC2 -> 3 | F3: =R2C*RC2 -> 4 | G3: =R2C*RC2 -> 5 | H3: =R2C*RC2 -> 6 | I3: =R2C*RC2 -> 7 | J3: =R2C*RC2 -> 8 | K3: =R2C*RC2 -> 9 | L3: =R2C*RC2 -> 10
B4: 2 | C4: =R2C3*RC[-1] -> 2 | D4: =R2C*RC2 -> 4 | E4: =R2C*RC2 -> 6 | F4: =R2C*RC2 -> 8 | G4: =R2C*RC2 -> 10 | H4: =R2C*RC2 -> 12 | I4: =R2C*RC2 -> 14 | J4: =R2C*RC2 -> 16 | K4: =R2C*RC2 -> 18 | L4: =R2C*RC2 -> 20
B5: 3 | C5: =R2C3*RC[-1] -> 3 | D5: =R2C*RC2 -> 6 | E5: =R2C*RC2 -> 9 | F5: =R2C*RC2 -> 12 | G5: =R2C*RC2 -> 15 | H5: =R2C*RC2 -> 18 | I5: =R2C*RC2 -> 21 | J5: =R2C*RC2 -> 24 | K5: =R2C*RC2 -> 27 | L5: =R2C*RC2 -> 30
B6: 4 | C6: =R2C3*RC[-1] -> 4 | D6: =R2C*RC2 -> 8 | E6: =R2C*RC2 -> 12 | F6: =R2C*RC2 -> 16 | G6: =R2C*RC2 -> 20 | H6: =R2C*RC2 -> 24 | I6: =R2C*RC2 -> 28 | J6: =R2C*RC2 -> 32 | K6: =R2C*RC2 -> 36 | L6: =R2C*RC2 -> 40
B7: 5 | C7: =R2C3*RC[-1] -> 5 | D7: =R2C*RC2 -> 10 | E7: =R2C*RC2 -> 15 | F7: =R2C*RC2 -> 20 | G7: =R2C*RC2 -> 25 | H7: =R2C*RC2 -> 30 | I7: =R2C*RC2 -> 35 | J7: =R2C*RC2 -> 40 | K7: =R2C*RC2 -> 45 | L7: =R2C*RC2 -> 50
B8: 6 | C8: =R2C3*RC[-1] -> 6 | D8: =R2C*RC2 -> 12 | E8: =R2C*RC2 -> 18 | F8: =R2C*RC2 -> 24 | G8: =R2C*RC2 -> 30 | H8: =R2C*RC2 -> 36 | I8: =R2C*RC2 -> 42 | J8: =R2C*RC2 -> 48 | K8: =R2C*RC2 -> 54 | L8: =R2C*RC2 -> 60
B9: 7 | C9: =R2C3*RC[-1] -> 7 | D9: =R2C*RC2 -> 14 | E9: =R2C*RC2 -> 21 | F9: =R2C*RC2 -> 28 | G9: =R2C*RC2 -> 35 | H9: =R2C*RC2 -> 42 | I9: =R2C*RC2 -> 49 | J9: =R2C*RC2 -> 56 | K9: =R2C*RC2 -> 63 | L9: =R2C*RC2 -> 70
B10: 8 | C10: =R2C3*RC[-1] -> 8 | D10: =R2C*RC2 -> 16 | E10: =R2C*RC2 -> 24 | F10: =R2C*RC2 -> 32 | G10: =R2C*RC2 -> 40 | H10: =R2C*RC2 -> 48 | I10: =R2C*RC2 -> 56 | J10: =R2C*RC2 -> 64 | K10: =R2C*RC2 -> 72 | L10: =R2C*RC2 -> 80
B11: 9 | C11: =R2C3*RC[-1] -> 9 | D11: =R2C*RC2 -> 18 | E11: =R2C*RC2 -> 27 | F11: =R2C*RC2 -> 36 | G11: =R2C*RC2 -> 45 | H11: =R2C*RC2 -> 54 | I11: =R2C*RC2 -> 63 | J11: =R2C*RC2 -> 72 | K11: =R2C*RC2 -> 81 | L11: =R2C*RC2 -> 90
B12: 10 | C12: =R2C3*RC[-1] -> 10 | D12: =R2C*RC2 -> 20 | E12: =R2C*RC2 -> 30 | F12: =R2C*RC2 -> 40 | G12: =R2C*RC2 -> 50 | H12: =R2C*RC2 -> 60 | I12: =R2C*RC2 -> 70 | J12: =R2C*RC2 -> 80 | K12: =R2C*RC2 -> 90 | L12: =R2C*RC2 -> 100
B13: 11 | C13: =R2C3*RC[-1] -> 11 | D13: =R2C*RC2 -> 22 | E13: =R2C*RC2 -> 33 | F13: =R2C*RC2 -> 44 | G13: =R2C*RC2 -> 55 | H13: =R2C*RC2 -> 66 | I13: =R2C*RC2 -> 77 | J13: =R2C*RC2 -> 88 | K13: =R2C*RC2 -> 99 | L13: =R2C*RC2 -> 110
B14: 12 | C14: =R2C3*RC[-1] -> 12 | D14: =R2C*RC2 -> 24 | E14: =R2C*RC2 -> 36 | F14: =R2C*RC2 -> 48 | G14: =R2C*RC2 -> 60 | H14: =R2C*RC2 -> 72 | I14: =R2C*RC2 -> 84 | J14: =R2C*RC2 -> 96 | K14: =R2C*RC2 -> 108 | L14: =R2C*RC2 -> 120
B15: 13 | C15: =R2C3*RC[-1] -> 13 | D15: =R2C*RC2 -> 26 | E15: =R2C*RC2 -> 39 | F15: =R2C*RC2 -> 52 | G15: =R2C*RC2 -> 65 | H15: =R2C*RC2 -> 78 | I15: =R2C*RC2 -> 91 | J15: =R2C*RC2 -> 104 | K15: =R2C*RC2 -> 117 | L15: =R2C*RC2 -> 130
B16: 14 | C16: =R2C3*RC[-1] -> 14 | D16: =R2C*RC2 -> 28 | E16: =R2C*RC2 -> 42 | F16: =R2C*RC2 -> 56 | G16: =R2C*RC2 -> 70 | H16: =R2C*RC2 -> 84 | I16: =R2C*RC2 -> 98 | J16: =R2C*RC2 -> 112 | K16: =R2C*RC2 -> 126 | L16: =R2C*RC2 -> 140
B17: 15 | C17: =R2C3*RC[-1] -> 15 | D17: =R2C*RC2 -> 30 | E17: =R2C*RC2 -> 45 | F17: =R2C*RC2 -> 60 | G17: =R2C*RC2 -> 75 | H17: =R2C*RC2 -> 90 | I17: =R2C*RC2 -> 105 | J17: =R2C*RC2 -> 120 | K17: =R2C*RC2 -> 135 | L17: =R2C*RC2 -> 150